Question,Answer,Rating
Strategy for investing large amount of cash,"It is a good strategy to invest in stocks because they are cheap, have low volatility and don't lose value very easily.  The only risk you might face is if the company goes bankrupt or if you lose a significant portion of your investment.  For this reason you should avoid equities because they have low returns and are not very diversified.", 
Is it a good idea to put everything in the S&P500?,"The S&P520 has a good percentage of US stocks (41%) that are held by US citizens. You are still a good idea to buy US stocks in general, and US equities in particular.", 
Estate taxes and the top 1 percent by net worth,"This isn't a question that has been asked or answered before.  I've tried to answer it but the answer to my own question is ""Yes"". I don't believe that any estate tax would be levied on anyone that makes less than $250k. I have done some research on the subject and have found that estate tax is levied on the top 1% of the estate.  I also found that this tax has not been levied on people making less than $1M.  So I don't think it is levied on anyone. I hope this helps.", 
Questions about government bonds that have already matured,"I think the question you are looking for is: ""What are the best/worst bonds that I can buy in the future"". The answer to this question depends a lot on your risk tolerance. If you are looking for a bond that you can buy in the next few years, and you are not worried about the issuer defaulting, you should look at the following bonds: This should help you to decide which issuer to buy the bond from. You should also look at the bond price, since this will help you determine if the issuer has made good on its promises. The last two bonds I've mentioned should help you decide which issuer you should buy the bond from, as well.", 
Should I wait a few days to sell ESPP Stock?,"I wouldn't wait. It is likely that the ESPP is in the 10% range, so it will probably be worth selling. If the ESPP is higher, it is likely to be worth selling at a higher price.", 
How will the fall of the UK Pound impact purchasing my first property?,"In the past, this was a common thing to do. But with the Brexit vote, you will be a lot more vulnerable to this. In the US, this is more true for first time home buyers.", 
Best way for for soon to turn 18 to learn about money?,"If you're looking for something that will give you some direction on where you want to be financially, it's important to do it on your own.  You need to learn how to be a good citizen with a good work ethic.  It will make your life easier and less stressful in the long run.", 
"Is it better to buy a computer on my credit card, or on credit from the computer store?","I would not recommend the computer store as a long term investment.  I've seen some of the other answers here suggest that they can be a good long term investment for the right person.  The reality is, though, that they have a long term problem: they're going to have to pay for the computer for the next 10 years or more.  And in the meantime, they're going out of business.  If you buy a computer for a month, and then have to pay for it for 10 years, you can expect to be out of business in a few years. I would not recommend the credit card as a long term, high risk investment.  It will take a long time for you to pay for it.  If you can't afford it, you'll be in trouble.  And if you're going to be in trouble, the store is going to be in a lot of trouble.", 
Multiple hard inquiry for a single loan from car dealer?,"If you want a different bank, call them and tell them that you want to close the loan early.  That way you can avoid closing the loan and you won't be impacted.  They should be able to tell you why the loan was not closed, and they can close it in a timely manner.", 
How do I figure out the next step in deciding to sell my home to the market or to a uniquely interested buyer?,"First of all, you need to know the exact numbers. If you are not sure, you should consult a professional, because this is very important. The real estate agent will be able to give you an exact figure. If you have not sold yet, that's great! If you've already bought the house, congratulations! You have a huge advantage, because you already have a lot of knowledge about the house and the market. You can use the same tools you would have used in the past: The trick is to find the right buyer. That is the hardest part.", 
Where to find historical quotes for the Dow Jones Global Total Stock Market Index?,"The Dow Jones Total Stock Market Index Quote is listed on the Dow Jones website, along with the other historical data feeds.", 
Is there a country that uses the term “dollar” for currency without also using “cents” as fractional monetary units?,"It's called the Dollar-era, and is one of the oldest currencies in the world. In fact, it was invented by the Bank of England, who used it as the basis for the London Pound (later called the Pound Sterling). It was used by countries like Japan and the UK from the 1870s onward. However, it is also used in some emerging markets like Hong Kong, and by governments that are using currencies like the Thai baht.", 
Shares in Chinese startup company,"Their shares are in Chinese. There is a Chinese company called Dongguan Tech, which is headquartered in Shenzhen, China. They are a startup and there are no shares held by them. If they want to be publicly traded on China stock market, you should buy the shares on China stock market. They are not publicly traded in Shanghai.", 
Where should I invest my savings?,You might want to consider the following:, 
Can't the account information on my checks be easily used for fraud?,I just looked at this link: https://www.check-freeze.com/faqs/faq-109.html#what-happens-if-i-have-not-paid-my-bills-with-the-check-i-received, 
Why do I get a much better price for options with a limit order than the ask price?,"I know there's a ""risk premium"" to be had by doing this, but I'm not sure that's the case in this case.  The ask price of 1.10 is probably closer to the ask price of 0.10 (which is a reasonable price to ask) than the bid price of 11000.  I'm not entirely sure if this is a ""risk"" premium, though; the bid price is probably not too far above the ask price, but if you have a high enough ask bid price, you may get a better deal.", 
Advantages/disadvantages of buying stocks on dips vs buying outright?,"I have seen several people suggest that selling off shares of stock to reduce risk. This is a very simple way to reduce risk, but it is also a very complicated way to reduce risk. I have been a little hesitant to do it because it makes it more complicated to manage. I would say that the key is the ability to manage risk. If I buy shares of stock and it goes up I don't need to worry about it. But I would say that I have been lucky in that I have never had a stock go down. I have had the stock drop 30% but not once. I would be happy if I could have done this 200 times.", 
Is sales tax for online purchases based on billing- or shipping address?,"The fact is that tax authorities consider the shipping address the same as the customer's physical address, regardless of the method of shipping. I'm not sure if this is a case of not having a physical address or not having a physical location, but I have never had an issue with sales tax, and my local bank doesn't require it. The IRS doesn't seem to like it.", 
Which U.S. online discount broker is the best value for money?,"I would say it is probably better to use a free broker. I use E*Trade, but I'm not sure if they still offer online trading.", 
How will my stock purchase affect my taxes?,"Yes, it is possible to have a stock purchase be a gift tax deductible.  You will want to talk to a licensed tax adviser who is familiar with this situation.", 
What is the psychology behind the Dead Cat Bounce Pattern and how can it be traded?,"It's an unpredictable market, and the psychology behind it is the same as anything else.  It's just the way the market reacts to things. If you have a bad day, it will go down again, or worse. That's what happens.", 
Is it possible for me to keep my credit card APR at 0% permanently?,"It's possible to keep your card's APR at 1% for the life of the card if you don't use it.  This is called a ""no-fee balance transfer"".", 
How does a online only bank protect itself against fraud? ,The safest way is for the bank to have the right to check the records of your account. The safest way is to make sure that there is no transaction which has not been reported to the bank and to report that to the police and to the relevant authorities. It would also be very good to have records of your purchases and of the bank's actions., 
How credible is Stansberry's video “End of America”?,You can probably watch his video on youtube if you are in the USA. The video is from 2007.  Here is a link to the video.  http://www.youtube.com/watch?v=T1284OgY4o0, 
Comparing/reviewing personal health insurance plans for the self-employed,"I am assuming you're in the US. I can't find a comparable question about Canada, but the US is a good comparison as well.  Here is one that you might find interesting:  http://www.thehill.com/blogs/the-hill-us-insurance-blog/president-clinton-health-care-plan", 
What is the big deal about the chinese remnibi trading hub that opened in toronto,"If you look at it this way, you can't do anything wrong with a remibi, it just means you are investing in a market that is not yet well-known.  It's probably better to just wait and invest your money in the stock market.", 
Why diversify stocks/investments?,"If you want to diversify you should invest in stocks and bonds because you want to diversity in different asset classes. Investing in stocks is a way to diversify and have a small portion of your money in stocks, while you can invest in bonds too.  It's important to diversify in order to maintain a low risk/high return ratio.", 
Why do stocks priced above $2.00 on the ASX sometimes move in $0.005 increments?,"I think you are missing something, but I can't find a way to get a good answer. I have been able to trade this stock, but not at a consistent enough rate to make it worth it. My guess is that the price is not just the price of the last trade but also a percentage of what I am looking at.", 
Do stocks give you more control over your finances than mutual funds?,"You can have some level of control over your finance through stock market trading.  In the UK, there are several options for stock trading and they are all free. The options are all listed on the Financial Ombudsman Service, which can help you with many questions regarding stock market transactions and how they work.  If you want to invest in companies or stocks on the UK market, you can find information on the Financal Ombudsmen Service here.", 
Why do people buy insurance even if they have the means to overcome the loss?,"One of the most significant reasons is that the insurance company is hoping to sell the insurance.  If they were to lose you and they could get back your money, they might do that.  They might do this by increasing premiums.  They might offer a policy for less money.  They might sell a policy with a higher deductible.  They might even offer an optional add-on to cover you for something you never asked for.", 
Why does it take two weeks (from ex-date) for dividends to pay out?,"I'm sure there are plenty of other answers to this question, but I believe there's a simple explanation: The ex-date is just a day on the calendar (as the company has to pay taxes and make a filing on that date). So if a company is paying out dividends every two weeks, they need to make sure that their investors get their payments on the second week.", 
Buying insurance (extended warranty or guarantee) on everyday goods / appliances?,"You are making assumptions that the product you bought is ""uncommon"", so you should expect that there is a small chance of it breaking. The manufacturer is also unlikely to do a recall, as you are buying a new model and you are expecting the new model to last longer than the previous one. I would suggest to go with the product you bought.", 
"The U.S. National Debt: What is it, where did it come from, and how does it work?","The United States has about $3 trillion in debt. That's a lot of debt. The federal debt is around $200 billion.  The debt is mostly on loans to businesses, the government, and individuals.  The United States has $200 trillion in federal debt. If you want to read about the financial history of the United States, you should start with the Federal Reserve Report.", 
